Book Name,Author,Rating,Customers_Rated,Price
My First Book of Patterns Pencil Control: Patterns Practice book for kids (Pattern Writing),Wonder House Books,4.4 out of 5 stars,"5,476",₹ 89.00
My First Library: Boxset of 10 Board Books for Kids,Wonder House Books,4.5 out of 5 stars,"23,791",₹ 399.00
The Psychology of Money,Morgan Housel,4.5 out of 5 stars,"9,938",₹ 349.00
Karma: A Yogi's Guide to Crafting Your Destiny,Sadhguru,4.7 out of 5 stars,631,₹ 250.00
Ikigai: The Japanese secret to a long and happy life,Héctor García,4.6 out of 5 stars,"14,744",₹ 390.00
"Writing Practice Boxset: Pack of 4 Books (Writing Fun: Write and Practice Capital Letters, Small Letters, Patterns and…",Wonder House Books,4.4 out of 5 stars,"2,803",₹ 159.00
Rich Dad Poor Dad: What the Rich Teach Their Kids About Money That the Poor and Middle Class Do Not!,Robert T. Kiyosaki,4.6 out of 5 stars,"41,193",₹ 302.00
"Grandma's Bag of Stories: Collection of 20+ Illustrated short stories, traditional Indian folk tales for all ages for…",Sudha Murty,4.6 out of 5 stars,"5,476",₹ 183.00
Indian Polity - For Civil Services and Other State Examinations | 6th Edition,M. Laxmikanth,4.6 out of 5 stars,"8,956",₹ 614.00
QAWACHH The Alchemist by Paulo Coelho,QAWACHH,4.6 out of 5 stars,"54,385",₹ 182.00
Quantitative Aptitude for Competitive Examinations,R S Aggarwal,4.4 out of 5 stars,"12,045",₹ 460.00
Very First Sight Words Sentences Level - 1,Dreamland Publications,4.5 out of 5 stars,"3,417",₹ 108.00
101 Panchatantra Stories for Children: Colourful Illustrated Stories,Om Books Editorial Team,4.5 out of 5 stars,"1,243",₹ 135.00
The Blue Umbrella,Ruskin Bond,4.5 out of 5 stars,"4,776",₹ 69.00
Oxford Student Atlas for India - Third Edition,Oxford University Press,4.6 out of 5 stars,"5,709",₹ 223.00
World’s Greatest Books For Personal Growth & Wealth (Set of 4 Books): Perfect Motivational Gift Set,Dale Carnegie,4.5 out of 5 stars,"6,546",₹ 299.00
101 Brain Booster Activity Book: Fun Activity Book For Children,Wonder House Books,4.4 out of 5 stars,"1,149",₹ 129.00
Word Power Made Easy,Norman Lewis,4.4 out of 5 stars,"20,953",₹ 95.00
Atomic Habits: The life-changing million copy bestseller,James Clear,4.6 out of 5 stars,"19,735",₹ 646.00
Man's Search For Meaning: The classic tribute to hope from the Holocaust,Viktor E Frankl,4.5 out of 5 stars,"31,059",₹ 180.00
Life's Amazing Secrets: How to Find Balance and Purpose in Your Life,Gaur Gopal Das,4.6 out of 5 stars,"7,724",₹ 158.00
Picture Books Collection for Early Learning (Set of 12),E C Axus,4.2 out of 5 stars,"6,107",₹ 235.00
26 Years UPSC IAS/ IPS Prelims Topic-wise Solved Papers 1 & 2 (1995 - 2020) 11th Edition,Mrunal Patel,4.5 out of 5 stars,"2,036",₹ 326.00
Lines and Curves (Pattern Writing) - Part 1,Dreamland Publications,4.4 out of 5 stars,"2,775",₹ 65.00
One Arranged Murder,Chetan Bhagat,4.3 out of 5 stars,"9,330",₹ 144.00
Great Stories for Children,Ruskin Bond,4.5 out of 5 stars,"4,332",₹ 141.00
1001 Activities Book,Dreamland Publications,4.5 out of 5 stars,"4,228",₹ 240.00
Objective NCERT at your FINGERTIPS for NEET-AIIMS - Biology,MTG Editorial Board,4.6 out of 5 stars,"1,600",₹ 533.00
The Intelligent Investor (English) Paperback – 2013,Benjamin Graham,4.5 out of 5 stars,"23,801",₹ 444.00
Attitude Is Everything: Change Your Attitude ... Change Your Life!,Jeff Keller,4.5 out of 5 stars,"9,116",₹ 161.00
As a Man Thinketh,James Allen,4.4 out of 5 stars,"2,257",₹ 59.00
505 Activities for Kids,Dreamland Publications,4.4 out of 5 stars,"3,187",₹ 165.00
Certificate Physical And Human Geography; Indian Edition,Goh Cheng Leong,4.5 out of 5 stars,"6,043",₹ 325.00
General Knowledge,Dr. Binay Karna,4.4 out of 5 stars,"11,316",₹ 198.00
Best of Children’s Classics (Set of 5 Books): Perfect Gift Set for Kids,Antoine de Saint-Exupéry,4.4 out of 5 stars,647,₹ 499.00
Animals Tales From Panchtantra: Timeless Stories for Children From Ancient India,Wonder House Books,4.6 out of 5 stars,793,₹ 159.00
My First 4 in 1 Alphabet Numbers Colours Shapes: Padded Board Books,Wonder House Books,4.4 out of 5 stars,856,₹ 177.00
Sapiens: A Brief History of Humankind,Yuval Noah Harari,4.7 out of 5 stars,"33,226",₹ 469.00
Think and Grow Rich,Napoleon Hill,4.5 out of 5 stars,"48,128",₹ 139.00
Amazon Brand - Solimo Board Books for Kids (Set of 10),Solimo,4.5 out of 5 stars,"3,841",₹ 352.00
The Richest Man in Babylon,George S. Clason,4.4 out of 5 stars,"17,906",₹ 99.00
Moral Story Books for Kids (Pack of 10 Books) | 160 Total Pages | Illustrated Stories,Young Angels Publishing,4.3 out of 5 stars,533,₹ 225.00
Apke Avchetan Man Ki Shakti (The Power of your Subconscious Mind in Hindi),Joseph Murphy,4.4 out of 5 stars,"2,996",₹ 99.00
My First ABC Sticker Book: Exciting Sticker Book With 100 Stickers,Wonder House Books,4.4 out of 5 stars,435,₹ 139.00
Colour with Crayons Part - 1,Dreamland Publications,4.2 out of 5 stars,"2,446",₹ 56.00
"NCERT BOOK , Hornbill Textbook in English ,Snapshots Supplementary Reader in English for Class-XI (Core Course) ,[COMBO…",NCERT,4.2 out of 5 stars,75,₹ 82.00
Wuthering Heights,Emily Brontë,4.5 out of 5 stars,"11,212",₹ 99.00
My Activity- ABC Writing Book,Dreamland Publications,4.4 out of 5 stars,"1,115",₹ 65.00
The Complete Novels of Sherlock Holmes,Arthur Conan Doyle,4.5 out of 5 stars,"8,184",₹ 136.00
"The Magic of the Lost Temple: Illustrated, easy to read and much-loved first full length children’s fiction novel by…",Sudha Murty,4.7 out of 5 stars,"2,526",₹ 144.00
Think Like a Monk: The secret of how to harness the power of positivity and be happy now,Jay Shetty,4.7 out of 5 stars,"13,586",₹ 325.00
My First Complete Learning Library: Boxset of 20 Board Books Gift Set for Kids (Horizontal Design),Wonder House Books,4.6 out of 5 stars,"4,556",₹ 799.00
Pride & Prejudice,Jane Austen,4.5 out of 5 stars,"20,178",₹ 99.00
India & World Map ( Both Political & Physical ) with Constitution of India Chart & History of India Chart | NON…,Vidya Chitr Prakashan,4.6 out of 5 stars,175,₹ 180.00
Harry Potter and the Philosopher's Stone,J.K. Rowling,4.7 out of 5 stars,"27,524",₹ 282.00
The Monk Who Sold His Ferrari,Robin Sharma,4.5 out of 5 stars,"13,608",₹ 153.00
My Activity- ABC Colouring Book,Dreamland Publications,4.4 out of 5 stars,"1,565",₹ 78.00
Mathematics for Class 10 by R D Sharma (Examination 2021-22),R.D. Sharma,4.6 out of 5 stars,"1,681",₹ 447.00
A Modern Approach to Verbal & Non-Verbal Reasoning (2 Colour Edition),R.S. Aggarwal,4.4 out of 5 stars,"5,236",₹ 540.00
"NCERT textbooks physics, chemistry and biology class 11(5 books combo) 2019 edition",NCERT,4.1 out of 5 stars,819,₹ 759.00
How to Stop Worrying and Start Living: Time-Tested Methods for Conquering Worry,Dale Carnegie,4.4 out of 5 stars,"11,206",₹ 106.00
"The 5 AM Club: Own Your Morning, Elevate Your Life",Robin Sharma,4.4 out of 5 stars,"12,130",₹ 239.00
Mandala: Colouring Books for Adults with Tear Out Sheets (Adult Colouring Book),Wonder House Books,4.5 out of 5 stars,"1,163",₹ 129.00
"The Silent Patient: The record-breaking, multimillion copy Sunday Times bestselling thriller and Richard & Judy book…",Alex Michaelides,4.5 out of 5 stars,"69,987",₹ 360.00
The Theory of Everything: The Origin and Fate of the Universe,Stephen Hawking,4.6 out of 5 stars,"5,689",₹ 155.00
Mandala Art: Colouring Books for Adults with Tear Out Sheets (Adult Colouring Book),Wonder House Books,4.6 out of 5 stars,"1,157",₹ 129.00
Mathematics for Class 11 (set of 2 volumes) Examination 2021-22: Vol. 2,R.D. Sharma,4.6 out of 5 stars,854,₹ 598.00
Peppa Pig: Little Library,Peppa Pig,4.3 out of 5 stars,"13,664",₹ 144.00
Bhagavad Gita: Yatharoop (Hindi),A.C. Bhaktivendanta Swami Prabhupada,4.8 out of 5 stars,"6,626",₹ 170.00
Ruskin Bond - Best Selling Children Story Books Collection (Set of 4 Books),Ruskin Bond,4.5 out of 5 stars,"1,074",₹ 415.00
Inner Engineering: A Yogi’s Guide to Joy,Sadhguru,4.6 out of 5 stars,"9,531",₹ 178.00
Little Artist Series Fruits: Copy Colour Books,Wonder House Books,4.4 out of 5 stars,200,₹ 42.00
"Brain Games for Clever Kids: Puzzles to Exercise Your Mind (Buster Brain Games, 1)",Gareth Moore,4.3 out of 5 stars,"4,657",₹ 199.00
Indian Art and Culture for Civil Services and other Competitive Examinations,Nitin Singhania,4.6 out of 5 stars,"2,671",₹ 545.00
To Kill A Mockingbird: 50th Anniversary Edition: 60th Anniversary Edition,Harper Lee,4.5 out of 5 stars,"39,439",₹ 223.00
All In One - Writing Book (Practice),Maple Press,4.4 out of 5 stars,"1,299",₹ 149.00
Rich Dad Poor Dad - 20th Anniversary Edition (Hindi),Robert T. Kiyosaki,4.6 out of 5 stars,"5,168",₹ 199.00
Capital Letters ABC: Write and practice Capital Letters A to Z book for kids (Writing Fun),Wonder House Books,4.3 out of 5 stars,995,₹ 42.00
A Man Called Ove: The life-affirming bestseller that will brighten your day,Fredrik Backman,4.6 out of 5 stars,"26,624",₹ 255.00
A Brief History of Modern India (2019-2020 Edition) by Spectrum Books,Spectrum Books Pvt.Ltd.,4.5 out of 5 stars,"5,952",₹ 412.00
Brilliant Brain Activity Book 3+,Dreamland Publications,4.6 out of 5 stars,842,₹ 138.00
NCERT textbooks class 12th physics part 1&2 chemistry part 1&2 and biology combo 2019 edition (pack of 5 books),tnscert,4.2 out of 5 stars,989,₹ 746.00
Very First Sight Words Sentences Level - 2,Dreamland Publications,4.6 out of 5 stars,"1,324",₹ 120.00
101 Maze Activity Book: Fun Activity Book For Children,Wonder House Books Editorial,4.2 out of 5 stars,784,₹ 129.00
A Brief History of Modern India - 2020-21/edition,Rajiv Ahir,4.3 out of 5 stars,414,₹ 282.00
Princess Colouring Book (Giant Book Series): Jumbo Sized Colouring Books (Giant Colouring Book Series),Wonder House Books,4.5 out of 5 stars,791,₹ 99.00
Refreshing Mandala - Colouring Book for Adults Book 1,Dreamland Publications,4.6 out of 5 stars,"3,614",₹ 150.00
Brilliant Brain Activity Book 4+,Dreamland Publications,4.6 out of 5 stars,827,₹ 138.00
"Three Thousand Stitches: Ordinary People, Extraordinary Lives",Sudha Murty,4.6 out of 5 stars,"3,305",₹ 181.00
How to Prepare for Verbal Ability and Reading Comprehension for CAT | 9th Edition,Arun Sharma,4.5 out of 5 stars,747,₹ 715.00
Grandparents' Bag of Stories,Sudha Murty,4.8 out of 5 stars,585,₹ 193.00
Concept of Physics Part-1 (2019-2020 Session) by H.C Verma,H.C. Verma,4.6 out of 5 stars,"5,428",₹ 430.00
"Blossom Jumbo Colouring Book for Kids 3 years to 5 years old | Drawing, Coloring and Art Book for Girls and Boys | A3…",Content Team at Target Publications,4.5 out of 5 stars,714,₹ 153.00
Mahatma Gandhi Autobiography: The Story Of My Experiments With Truth,Mahatma Gandhi,4.5 out of 5 stars,"2,861",₹ 149.00
365 Colouring Book,Dreamland Publications,4.6 out of 5 stars,"1,884",₹ 210.00
Nationalism,Rabindranath Tagore,4.5 out of 5 stars,"1,730",₹ 61.00
Objective General English,S.P. Bakshi,4.3 out of 5 stars,"7,217",₹ 203.00
My Activity- Phonics Activity Book,Dreamland Publications,4.5 out of 5 stars,"1,146",₹ 65.00
Death; An Inside Story: A book for all those who shall die,Sadhguru,4.7 out of 5 stars,"4,779",₹ 200.00
Mathematics for Class 9 by R D Sharma (Examination 2021-22),R.D. Sharma,4.6 out of 5 stars,"1,161",₹ 408.00
